{
  "schema": "maintenance-superinteligence.causal-adjudication-plan.v1",
  "version": "1.0.0",
  "nature": "author_synthetic_adjudication_drafts_not_engineering_approval",
  "humanAdjudicatorAuthenticated": false,
  "independentExpertAdjudicationCompleted": false,
  "items": [
    {
      "adjudicationId": "SIM-ADJ-001",
      "ruleId": "DISC-001-1",
      "parentRecordId": "MECH-KB-001",
      "reviewIds": [
        "SIM-CR-001-1",
        "SIM-CR-001-2"
      ],
      "originalRuleText": "Se registros de abastecimento e laboratório documentarem produtos de formulações diferentes em janelas contíguas",
      "editorialPriority": "high_review_priority",
      "proposedDisposition": "defer_disputed_relation",
      "reasoning": "O parecer autoral referente a DISC-001-1 está dividido entre manter e reformular a relação. O contraexemplo associado a oil_formula_baseline_change não foi resolvido por evidência independente; conservar as duas posições sem escolher vencedores.",
      "counterexampleDisposition": "open_counterexample_pending_independent_review",
      "referencedGeneralSources": [
        "CAT-SOS-READ"
      ],
      "draftWording": null,
      "reviewerQualifiedIndependently": false,
      "externalTechnicalApproval": false,
      "physicalCaseVerification": false,
      "oemEffectivityVerified": false,
      "mayAmendUpstream": false,
      "mayAuthorizeTest": false,
      "mayCreateWorkOrder": false,
      "mayReleaseEquipment": false
    },
    {
      "adjudicationId": "SIM-ADJ-002",
      "ruleId": "DISC-001-2",
      "parentRecordId": "MECH-KB-001",
      "reviewIds": [
        "SIM-CR-002-1",
        "SIM-CR-002-2"
      ],
      "originalRuleText": "Se histórico e fichas de produto documentarem o mesmo lubrificante durante todo o período",
      "editorialPriority": "medium_review_priority",
      "proposedDisposition": "propose_unapproved_wording_revision",
      "reasoning": "Os dois comentários editoriais de DISC-001-2 concordam em solicitar reformulação condicional. A proposta melhora a explicitação dos limites e permanece apenas como versão candidata, sem modificar a regra original ou demonstrar nexo causal.",
      "counterexampleDisposition": "counterexample_not_resolved_by_wording",
      "referencedGeneralSources": [
        "CAT-SOS-READ"
      ],
      "draftWording": "Se histórico e fichas de produto documentarem o mesmo lubrificante durante todo o período; caso confirmada por procedimento autorizado e aplicável, essa condição terá somente valor discriminante relativo e não comprovará causa raiz, efetividade OEM por série ou autorização operacional",
      "reviewerQualifiedIndependently": false,
      "externalTechnicalApproval": false,
      "physicalCaseVerification": false,
      "oemEffectivityVerified": false,
      "mayAmendUpstream": false,
      "mayAuthorizeTest": false,
      "mayCreateWorkOrder": false,
      "mayReleaseEquipment": false
    },
    {
      "adjudicationId": "SIM-ADJ-003",
      "ruleId": "DISC-001-3",
      "parentRecordId": "MECH-KB-001",
      "reviewIds": [
        "SIM-CR-003-1",
        "SIM-CR-003-2"
      ],
      "originalRuleText": "Se os produtos e as datas de coleta permanecerem sem identificação inequívoca",
      "editorialPriority": "watch_review_priority",
      "proposedDisposition": "reject_unsubstantiated_inference",
      "reasoning": "Os dois comentários editoriais de DISC-001-3 declaram suporte insuficiente. Rejeita-se apenas a inferência causal como fundamento de decisão técnica, preservando a versão original no histórico para futura revisão baseada em evidências.",
      "counterexampleDisposition": "no_causal_claim_accepted_due_to_insufficient_evidence",
      "referencedGeneralSources": [
        "CAT-SOS-READ"
      ],
      "draftWording": null,
      "reviewerQualifiedIndependently": false,
      "externalTechnicalApproval": false,
      "physicalCaseVerification": false,
      "oemEffectivityVerified": false,
      "mayAmendUpstream": false,
      "mayAuthorizeTest": false,
      "mayCreateWorkOrder": false,
      "mayReleaseEquipment": false
    },
    {
      "adjudicationId": "SIM-ADJ-004",
      "ruleId": "DISC-002-1",
      "parentRecordId": "MECH-KB-002",
      "reviewIds": [
        "SIM-CR-004-1",
        "SIM-CR-004-2"
      ],
      "originalRuleText": "Se duas coletas documentadas e rastreáveis repetirem indicação de partículas estranhas",
      "editorialPriority": "high_review_priority",
      "proposedDisposition": "defer_disputed_relation",
      "reasoning": "O parecer autoral referente a DISC-002-1 está dividido entre manter e reformular a relação. O contraexemplo associado a external_particle_contamination não foi resolvido por evidência independente; conservar as duas posições sem escolher vencedores.",
      "counterexampleDisposition": "open_counterexample_pending_independent_review",
      "referencedGeneralSources": [
        "CAT-SOS-READ"
      ],
      "draftWording": null,
      "reviewerQualifiedIndependently": false,
      "externalTechnicalApproval": false,
      "physicalCaseVerification": false,
      "oemEffectivityVerified": false,
      "mayAmendUpstream": false,
      "mayAuthorizeTest": false,
      "mayCreateWorkOrder": false,
      "mayReleaseEquipment": false
    },
    {
      "adjudicationId": "SIM-ADJ-005",
      "ruleId": "DISC-002-2",
      "parentRecordId": "MECH-KB-002",
      "reviewIds": [
        "SIM-CR-005-1",
        "SIM-CR-005-2"
      ],
      "originalRuleText": "Se a primeira coleta apresentar divergência de frasco ou local e a repetição confiável não registrar o mesmo sinal",
      "editorialPriority": "medium_review_priority",
      "proposedDisposition": "propose_unapproved_wording_revision",
      "reasoning": "Os dois comentários editoriais de DISC-002-2 concordam em solicitar reformulação condicional. A proposta melhora a explicitação dos limites e permanece apenas como versão candidata, sem modificar a regra original ou demonstrar nexo causal.",
      "counterexampleDisposition": "counterexample_not_resolved_by_wording",
      "referencedGeneralSources": [
        "CAT-SOS-READ"
      ],
      "draftWording": "Se a primeira coleta apresentar divergência de frasco ou local e a repetição confiável não registrar o mesmo sinal; caso confirmada por procedimento autorizado e aplicável, essa condição terá somente valor discriminante relativo e não comprovará causa raiz, efetividade OEM por série ou autorização operacional",
      "reviewerQualifiedIndependently": false,
      "externalTechnicalApproval": false,
      "physicalCaseVerification": false,
      "oemEffectivityVerified": false,
      "mayAmendUpstream": false,
      "mayAuthorizeTest": false,
      "mayCreateWorkOrder": false,
      "mayReleaseEquipment": false
    },
    {
      "adjudicationId": "SIM-ADJ-006",
      "ruleId": "DISC-002-3",
      "parentRecordId": "MECH-KB-002",
      "reviewIds": [
        "SIM-CR-006-1",
        "SIM-CR-006-2"
      ],
      "originalRuleText": "Se existir apenas uma leitura sem localização, tendência ou confirmação do material",
      "editorialPriority": "watch_review_priority",
      "proposedDisposition": "reject_unsubstantiated_inference",
      "reasoning": "Os dois comentários editoriais de DISC-002-3 declaram suporte insuficiente. Rejeita-se apenas a inferência causal como fundamento de decisão técnica, preservando a versão original no histórico para futura revisão baseada em evidências.",
      "counterexampleDisposition": "no_causal_claim_accepted_due_to_insufficient_evidence",
      "referencedGeneralSources": [
        "CAT-SOS-READ"
      ],
      "draftWording": null,
      "reviewerQualifiedIndependently": false,
      "externalTechnicalApproval": false,
      "physicalCaseVerification": false,
      "oemEffectivityVerified": false,
      "mayAmendUpstream": false,
      "mayAuthorizeTest": false,
      "mayCreateWorkOrder": false,
      "mayReleaseEquipment": false
    },
    {
      "adjudicationId": "SIM-ADJ-007",
      "ruleId": "DISC-003-1",
      "parentRecordId": "MECH-KB-003",
      "reviewIds": [
        "SIM-CR-007-1",
        "SIM-CR-007-2"
      ],
      "originalRuleText": "Se inspeção autorizada e registrada descrever padrão de dano compatível com rolamento, validado por especialista",
      "editorialPriority": "high_review_priority",
      "proposedDisposition": "defer_disputed_relation",
      "reasoning": "O parecer autoral referente a DISC-003-1 está dividido entre manter e reformular a relação. O contraexemplo associado a rolling_bearing_surface_damage não foi resolvido por evidência independente; conservar as duas posições sem escolher vencedores.",
      "counterexampleDisposition": "open_counterexample_pending_independent_review",
      "referencedGeneralSources": [
        "SKF-2022-ISO15243"
      ],
      "draftWording": null,
      "reviewerQualifiedIndependently": false,
      "externalTechnicalApproval": false,
      "physicalCaseVerification": false,
      "oemEffectivityVerified": false,
      "mayAmendUpstream": false,
      "mayAuthorizeTest": false,
      "mayCreateWorkOrder": false,
      "mayReleaseEquipment": false
    },
    {
      "adjudicationId": "SIM-ADJ-008",
      "ruleId": "DISC-003-2",
      "parentRecordId": "MECH-KB-003",
      "reviewIds": [
        "SIM-CR-008-1",
        "SIM-CR-008-2"
      ],
      "originalRuleText": "Se a origem documentada do ruído for outra peça e a evidência de rolamento estiver ausente",
      "editorialPriority": "medium_review_priority",
      "proposedDisposition": "propose_unapproved_wording_revision",
      "reasoning": "Os dois comentários editoriais de DISC-003-2 concordam em solicitar reformulação condicional. A proposta melhora a explicitação dos limites e permanece apenas como versão candidata, sem modificar a regra original ou demonstrar nexo causal.",
      "counterexampleDisposition": "counterexample_not_resolved_by_wording",
      "referencedGeneralSources": [